id,stageIds,name,overview,confirmed,lat,lng,stayLabel,summary,mapPrecision,tags
lodging-casa-cacao,trip-jul-01|trip-jul-02,Hotel Boutique Casa Cacao Girona,,yes,41.9823,2.8232,"Girona base, Jul 1-3","Chocolate hotel!!",Hotel-level pin,girona|lodging|jul-1-3|planning-pdf
lodging-yurbban-passage,trip-jul-03|trip-jul-04|trip-jul-05,Yurbban Passage Hotel & Spa,,no,41.3897,2.1762,"Barcelona base, Jul 3-6","Barcelona lodging for the opening Tour weekend, close enough to walk or transit to Montjuic viewing options.",Hotel-level pin,barcelona|lodging|jul-3-6
lodging-hotel-villa-paulita,trip-jul-06,Hotel Villa Paulita,,no,42.4334,1.9258,"Puigcerda base, Jul 6","Puigcerda lodging for Stage 3, keeping the practical town viewing options within walking distance.",Hotel-level pin,puigcerda|lodging|jul-6
lodging-arreau-airbnb,trip-jul-07|trip-jul-08|trip-jul-09,Arreau Airbnb,https://www.airbnb.com/trips/v1/reservation-details/ro/RESERVATION2_CHECKIN/HMZB8X4H5M,yes,42.9051,0.3609,"Arreau Airbnb, Jul 7-10","Arreau Airbnb at 3 Rue du Calvaire, Arreau, Occitanie 65240, France; Pyrenees base for transfer, recovery, Tourmalet stage logistics, and ride planning.",Address-level geocode for 3 Rue du Calvaire; verify against Airbnb/private pin before final navigation,arreau|lodging|airbnb|address-supplied|jul-7-10|pyrenees|address-geocoded
lodging-hotel-burdigala,trip-jul-10|trip-jul-11|trip-jul-12,Hotel Burdigala by Inwood Hotels,,no,44.8402,-0.5862,"Bordeaux base, Jul 10-13","Bordeaux lodging for the Stage 7 finish, Saint-Emilion, wine, city exploration, and the final night before the Paris transfer.",Hotel-level pin,bordeaux|lodging|jul-10-13
lodging-grand-hotel-malher,trip-jul-13|trip-jul-14|trip-jul-15|trip-jul-16|trip-jul-17|trip-jul-18|trip-jul-19,Grand Hôtel Malher,https://www.google.com/maps/place/Grand+H%C3%B4tel+Malher/data=!4m2!3m1!19sChIJESwV_v1x5kcRmu5PSA9ekP4,no,48.855616,2.361205,"Paris base, Jul 13-19","Paris lodging at Grand Hôtel Malher in the Marais near Saint-Paul metro, from arrival after the Bordeaux train through checkout before flying home to SFO.",Hotel-level pin,paris|lodging|grand-hotel-malher|marais|jul-13-19
